{
  "schemaVersion": "1.0",
  "tool": {
    "name": "vigilsutra",
    "version": "0.1.0",
    "rulesVersion": "1.0.0"
  },
  "generatedAt": "2026-10-30T19:49:45.760Z",
  "mode": "local",
  "project": {
    "name": "intentionally-insecure",
    "detected": [
      "docker",
      "terraform",
      "github-actions",
      "kubernetes"
    ]
  },
  "scope": {
    "root": "intentionally-insecure",
    "filesScanned": 5,
    "bytesScanned": 1200,
    "skippedIgnored": 0,
    "skippedSymlinks": 0,
    "skippedTooLarge": 0,
    "skippedBinary": 0,
    "skippedUnreadable": 0,
    "truncated": false
  },
  "summary": {
    "total": 16,
    "bySeverity": {
      "critical": 0,
      "high": 8,
      "medium": 5,
      "low": 2,
      "info": 1
    },
    "byStatus": {
      "potential": 9,
      "confirmed": 6,
      "informational": 1
    },
    "baselineSuppressed": 0
  },
  "categoriesAssessed": [
    "secrets",
    "cicd",
    "containers",
    "iac",
    "code",
    "ai-agents",
    "privacy",
    "process"
  ],
  "notAssessed": [
    "dependencies and advisories",
    "git history",
    "authentication and authorization design",
    "runtime / cloud state",
    "mobile apps",
    "data-flow and taint analysis"
  ],
  "limitations": [
    "Pattern-based static review of text files only; no data-flow or taint analysis.",
    "Source-pattern matches are reported as 'potential' unless the evidence itself is conclusive (for example a token format or an explicit unsafe setting).",
    "A match on a secret format shows the format, not that the credential is live. No credential was tested.",
    "Git history, dependencies, advisories, running systems and remote cloud state were not inspected.",
    "Absence of findings is not evidence of security."
  ],
  "findings": [
    {
      "id": "VS-CICD-002-11e3248d",
      "fingerprint": "11e3248dc10a2e4d5f1a7ca3436ca693",
      "ruleId": "VS-CICD-002",
      "ruleVersion": "1.0.0",
      "title": "pull_request_target workflow checks out pull-request code",
      "category": "cicd",
      "severity": "high",
      "confidence": "medium",
      "status": "potential",
      "agent": "PipelineGuard",
      "path": ".github/workflows/ci.yml",
      "startLine": 10,
      "endLine": 10,
      "evidenceType": "source-line",
      "excerpt": "ref: ${{ github.event.pull_request.head.sha }}",
      "redacted": false,
      "description": "A workflow triggered by `pull_request_target` runs with repository secrets and a write token. Checking out the PR head and then running its code lets an outside contributor execute code with those privileges.",
      "remediation": "Use `pull_request` for untrusted code. If `pull_request_target` is required, do not check out or execute PR-controlled content, and keep permissions minimal.",
      "falsePositives": "Workflows that check out the PR head but never build, run or source it (for example, labelling only).",
      "verification": "Confirm no step after the checkout executes files from the PR head, or remove the head checkout.",
      "cwe": [
        "CWE-829",
        "CWE-94"
      ],
      "mappingNote": "CWE ids are orientation only, taken from the MITRE CWE list; no OWASP/NIST control mapping is asserted (mapping unverified)."
    },
    {
      "id": "VS-CICD-004-3bcdb287",
      "fingerprint": "3bcdb287dbc0be65a5784aaa62a0ac9b",
      "ruleId": "VS-CICD-004",
      "ruleVersion": "1.0.0",
      "title": "Untrusted GitHub context interpolated into a shell step",
      "category": "cicd",
      "severity": "high",
      "confidence": "medium",
      "status": "potential",
      "agent": "PipelineGuard",
      "path": ".github/workflows/ci.yml",
      "startLine": 11,
      "endLine": 11,
      "evidenceType": "source-line",
      "excerpt": "- run: echo \"Title is ${{ github.event.pull_request.title }}\"",
      "redacted": false,
      "description": "Attacker-controlled fields (PR title/body, branch name, issue or comment text) are expanded directly inside a `run:` script. A crafted value can inject shell commands.",
      "remediation": "Pass the value through an environment variable (`env: TITLE: ${{ github.event.pull_request.title }}`) and reference it as `\"$TITLE\"` in the script.",
      "falsePositives": "Fields restricted by GitHub to safe characters. Only matches inside run blocks are reported when detectable; verify context.",
      "verification": "The expression no longer appears inside a `run:` body.",
      "cwe": [
        "CWE-78",
        "CWE-77"
      ],
      "mappingNote": "CWE ids are orientation only, taken from the MITRE CWE list; no OWASP/NIST control mapping is asserted (mapping unverified)."
    },
    {
      "id": "VS-K8S-002-e8757449",
      "fingerprint": "e8757449db9c9c28022eceed1a643272",
      "ruleId": "VS-K8S-002",
      "ruleVersion": "1.0.0",
      "title": "Pod shares host network, PID or IPC namespace",
      "category": "containers",
      "severity": "high",
      "confidence": "high",
      "status": "confirmed",
      "agent": "ContainerGuard",
      "path": "deployment.yaml",
      "startLine": 8,
      "endLine": 8,
      "evidenceType": "source-line",
      "excerpt": "hostNetwork: true",
      "redacted": false,
      "description": "hostNetwork, hostPID or hostIPC removes namespace isolation between the pod and the node.",
      "remediation": "Remove the host namespace flags unless the workload is a vetted node agent.",
      "falsePositives": "Node-level infrastructure agents.",
      "verification": "Flags removed; workload tested.",
      "cwe": [
        "CWE-653"
      ],
      "mappingNote": "CWE ids are orientation only, taken from the MITRE CWE list; no OWASP/NIST control mapping is asserted (mapping unverified)."
    },
    {
      "id": "VS-K8S-001-872a8614",
      "fingerprint": "872a8614818c1adfd9352829ee453c5f",
      "ruleId": "VS-K8S-001",
      "ruleVersion": "1.0.0",
      "title": "Kubernetes container runs privileged",
      "category": "containers",
      "severity": "high",
      "confidence": "high",
      "status": "confirmed",
      "agent": "ContainerGuard",
      "path": "deployment.yaml",
      "startLine": 13,
      "endLine": 13,
      "evidenceType": "source-line",
      "excerpt": "privileged: true",
      "redacted": false,
      "description": "`privileged: true` gives the container nearly all host capabilities and device access, so a container escape is trivial.",
      "remediation": "Remove `privileged: true`. Add only the specific capabilities needed and set `allowPrivilegeEscalation: false`.",
      "falsePositives": "Node-level system agents (CNI, storage drivers) that genuinely require it; keep them isolated.",
      "verification": "Manifest has no `privileged: true`; workload still starts.",
      "cwe": [
        "CWE-250"
      ],
      "mappingNote": "CWE ids are orientation only, taken from the MITRE CWE list; no OWASP/NIST control mapping is asserted (mapping unverified)."
    },
    {
      "id": "VS-IAC-002-acd7e6c2",
      "fingerprint": "acd7e6c2c716833b88217086f1c02364",
      "ruleId": "VS-IAC-002",
      "ruleVersion": "1.0.0",
      "title": "Public-read or public-write storage ACL",
      "category": "iac",
      "severity": "high",
      "confidence": "high",
      "status": "confirmed",
      "agent": "InfraGuard",
      "path": "main.tf",
      "startLine": 9,
      "endLine": 9,
      "evidenceType": "source-line",
      "excerpt": "acl = \"public-read\"",
      "redacted": false,
      "description": "A storage bucket ACL is set to a public canned ACL, exposing objects to anyone.",
      "remediation": "Use `private`, enable block-public-access, and serve public assets through a CDN with origin access control.",
      "falsePositives": "Buckets deliberately serving public static assets with no sensitive content.",
      "verification": "ACL is private and public access block is enabled.",
      "cwe": [
        "CWE-732"
      ],
      "mappingNote": "CWE ids are orientation only, taken from the MITRE CWE list; no OWASP/NIST control mapping is asserted (mapping unverified)."
    },
    {
      "id": "VS-CODE-002-5f4c0783",
      "fingerprint": "5f4c07837cbbbd543925e4c2c6d365b1",
      "ruleId": "VS-CODE-002",
      "ruleVersion": "1.0.0",
      "title": "Shell command built from a dynamic string",
      "category": "code",
      "severity": "high",
      "confidence": "medium",
      "status": "potential",
      "agent": "CodeGuard",
      "path": "server.js",
      "startLine": 5,
      "endLine": 5,
      "evidenceType": "source-line",
      "excerpt": "exec(`ping -c 1 ${req.query.host}`, () => res.send(\"ok\"));",
      "redacted": false,
      "description": "A shell is invoked with an interpolated or concatenated command string (or Python `shell=True`). Untrusted input can inject extra commands.",
      "remediation": "Use an argument array without a shell: `execFile(cmd, [args])` in Node, `subprocess.run([cmd, *args])` in Python. Validate inputs against an allowlist.",
      "falsePositives": "Fully constant commands. Interpolated values that are validated constants.",
      "verification": "Command uses an argument array; a test confirms metacharacters are not interpreted.",
      "cwe": [
        "CWE-78"
      ],
      "mappingNote": "CWE ids are orientation only, taken from the MITRE CWE list; no OWASP/NIST control mapping is asserted (mapping unverified)."
    },
    {
      "id": "VS-CODE-004-821316a5",
      "fingerprint": "821316a53c548a607dd94a1fd5c6919e",
      "ruleId": "VS-CODE-004",
      "ruleVersion": "1.0.0",
      "title": "SQL query built with string concatenation or interpolation",
      "category": "code",
      "severity": "high",
      "confidence": "medium",
      "status": "potential",
      "agent": "CodeGuard",
      "path": "server.js",
      "startLine": 6,
      "endLine": 6,
      "evidenceType": "source-line",
      "excerpt": "db.query(\"SELECT * FROM users WHERE id = \" + req.query.id);",